<?xml version="1.0" encoding="UTF-8"?>
<entity-mappings
    xmlns="http://lazydog.org/xml/ns/persistence-ldap/entity-mappings"
    xmlns:xsi="http://www.w3.org/2001/XMLSchema-instance"
    xsi:schemaLocation="http://lazydog.org/xml/ns/persistence-ldap/entity-mappings
                        http://lazydog.org/xml/ns/persistence-ldap/entity-mappings/entity-mappings.xsd">

    <entity class-name="org.lazydog.test.model.Account">
        <mapping>
            <property name="canonicalName"/>
            <attribute name="cn"/>
        </mapping>
        <mapping>
            <property name="displayName"/>
            <attribute name="displayName"/>
        </mapping>
        <mapping>
            <property name="lastName"/>
            <attribute name="sn"/>
        </mapping>
        <mapping>
            <property name="manager" target-entity="org.lazydog.test.model.Account" fetch-type="LAZY"/>
            <attribute name="manager"/>
        </mapping>
        <mapping>
            <property name="name"/>
            <attribute name="uid"/>
        </mapping>
        <object-class>
            <value>inetOrgPerson</value>
            <value>organizationalPerson</value>
            <value>person</value>
            <value>top</value>
        </object-class>
        <search-base value="ou=system"/>
        <search-scope value="SUBTREE"/>
    </entity>
</entity-mappings>